{
  "$schema": "./file-size-ratchet.schema.json",
  "schema": "symphony.architecture.file-size-ratchet.v1",
  "notes": [
    "SYMPH-1073 report-only window opened 2026-07-09. On 2026-07-23, inspect the actual Symphony PR stream, validate the 350/600 thresholds against observed false positives, and only then propose blocking enforcement.",
    "Only src/ is measured. Tests and generated declarations are exempt. Source modules at or above 600 lines may shrink or stay flat, but may not grow."
  ],
  "new_file_line_cap": 350,
  "no_growth_line_threshold": 600,
  "exempt_path_globs": [
    "**/*.test.*",
    "**/*.d.ts",
    "**/__generated__/**",
    "**/generated/**",
    "**/*.generated.*"
  ],
  "waivers": [
    {
      "path": "src/agent/triage-planner.ts",
      "rule": "file_size.no_growth_over_threshold",
      "reason": "SYMPH-1108/1109 coupled grading evidence; extraction tracked by SYMPH-1122",
      "expires": "2026-08-15"
    },
    {
      "path": "src/calibration/digest.ts",
      "rule": "file_size.no_growth_over_threshold",
      "reason": "SYMPH-1108/1109 coupled calibration output; extraction tracked by SYMPH-1122",
      "expires": "2026-08-15"
    },
    {
      "path": "src/cli/symphonyctl.ts",
      "rule": "file_size.no_growth_over_threshold",
      "reason": "SYMPH-1109 authenticated grading CLI; extraction tracked by SYMPH-1122",
      "expires": "2026-08-15"
    },
    {
      "path": "src/cli/manager-plan.ts",
      "rule": "file_size.no_growth_over_threshold",
      "reason": "SYMPH-1131 explicit planner-effort CLI contract; extraction tracked by SYMPH-1122",
      "expires": "2026-08-15"
    },
    {
      "path": "src/config/config-resolver.ts",
      "rule": "file_size.no_growth_over_threshold",
      "reason": "SYMPH-1131 explicit planner-effort config parsing; extraction tracked by SYMPH-1122",
      "expires": "2026-08-15"
    },
    {
      "path": "src/config/types.ts",
      "rule": "file_size.no_growth_over_threshold",
      "reason": "SYMPH-1131 explicit planner-effort config contract; extraction tracked by SYMPH-1122",
      "expires": "2026-08-15"
    },
    {
      "path": "src/domain/model.ts",
      "rule": "file_size.no_growth_over_threshold",
      "reason": "SYMPH-1108 journal-kind registration; extraction tracked by SYMPH-1122",
      "expires": "2026-08-15"
    },
    {
      "path": "src/observability/dashboard-server.ts",
      "rule": "file_size.no_growth_over_threshold",
      "reason": "SYMPH-1109 authenticated grading schema; extraction tracked by SYMPH-1122",
      "expires": "2026-08-15"
    },
    {
      "path": "src/orchestrator/core.ts",
      "rule": "file_size.no_growth_over_threshold",
      "reason": "SYMPH-1108/1109 append-only journal commit boundary; extraction tracked by SYMPH-1122",
      "expires": "2026-08-15"
    },
    {
      "path": "src/orchestrator/runtime-host.ts",
      "rule": "file_size.no_growth_over_threshold",
      "reason": "SYMPH-1109 authenticated grade routing and persistence; extraction tracked by SYMPH-1122",
      "expires": "2026-08-15"
    },
    {
      "path": "src/orchestrator/standing-plan-shadow.ts",
      "rule": "file_size.no_growth_over_threshold",
      "reason": "SYMPH-1108/1109 lifecycle evidence and revival scan; extraction tracked by SYMPH-1122",
      "expires": "2026-08-15"
    },
    {
      "path": "src/orchestrator/structural-advisory-journal.ts",
      "rule": "file_size.new_file_line_cap",
      "reason": "SYMPH-1108/1109 coupled journal projection; split tracked by SYMPH-1122",
      "expires": "2026-08-15"
    }
  ]
}
